CustomerName,Sector,Theme,CompanySize,ContactName,ProjectName,ProjectStatus,ProjectDescription
"Dudley, Alvarado and Cook",Education,Cybersecurity,$475 million,Kevin Parker,Data Warehouse Development,On Hold,"This project involves the comprehensive transformation of the client's digital landscape, leveraging cutting-edge AI and machine learning technologies to enhance operational efficiency and customer engagement. The initiative aims to integrate advanced data analytics and automation tools, facilitating real-time decision-making and predictive insights. By deploying scalable cloud infrastructure, the client will achieve greater flexibility and cost-efficiency. Additionally, the project includes the development of custom applications tailored to specific business needs, ensuring seamless workflow integration. Extensive training programs will be conducted to empower the client's workforce with the necessary skills to maximize the benefits of the new technologies. Ongoing support and maintenance services will be provided to ensure the sustained success of the digital transformation journey, positioning the client at the forefront of innovation in their industry."
"Jackson, Daniels and Williams",Technology,Data Analytics,$35 million,Victor Hoffman,AI & ML Integration,Pending,"The objective of this project is to migrate the client's existing IT infrastructure to a robust cloud platform, ensuring seamless integration, improved scalability, and enhanced security measures. This involves a detailed assessment of the current systems, followed by meticulous planning and execution of the migration process. By leveraging cloud technologies, the client will benefit from increased operational efficiency and reduced costs associated with hardware and maintenance. The project also includes the implementation of advanced security protocols to safeguard data and prevent breaches. Comprehensive training sessions will be conducted to equip the client's IT staff with the necessary skills to manage and optimize the new cloud environment. Continuous monitoring and support will be provided to ensure the smooth functioning of the cloud infrastructure, enabling the client to focus on their core business activities without technical disruptions."
Griffith-Vasquez,Technology,AI & Machine Learning,$110 million,Joseph Miller,AI & ML Integration,In Progress,"Our team is tasked with developing custom software solutions tailored to the client's specific needs, aimed at streamlining their business processes and driving innovation through technology. The project involves a thorough analysis of the client's operational requirements, followed by the design and development of bespoke applications that integrate seamlessly with existing systems. Advanced technologies such as AI, machine learning, and big data analytics will be utilized to enhance functionality and deliver actionable insights. Rigorous testing procedures will ensure the reliability and performance of the software. Training programs will be provided to familiarize the client's staff with the new tools and maximize their productivity. Ongoing support and updates will be offered to address any issues and incorporate new features, ensuring that the software continues to meet the evolving needs of the business."
Brown PLC,Healthcare,Cybersecurity,$459 million,Debra Dunlap,Cloud Implementation,Pending,"This initiative focuses on implementing a cloud-based solution for the client's manufacturing operations, optimizing their supply chain management and production workflows. The project includes the deployment of IoT devices and sensors to gather real-time data from the manufacturing floor, providing insights into equipment performance and production efficiency. Advanced analytics and machine learning algorithms will be used to predict maintenance needs and prevent downtime. The cloud platform will enable centralized monitoring and control, improving coordination across different production sites. Comprehensive training programs will be offered to ensure that the client's staff can effectively use the new tools. Continuous support and maintenance services will be provided to address any technical issues and ensure the smooth operation of the cloud-based system, driving efficiency and innovation in the client's manufacturing processes."
Reed-Rivera,Consulting,AI & Machine Learning,$414 million,Brittney Hall,Digital Transformation Initiative,Pending,"We are upgrading the client's IT infrastructure to modern standards, incorporating advanced security protocols, high-performance computing resources, and scalable network architectures. This project involves a thorough assessment of the current infrastructure, followed by the implementation of state-of-the-art technologies to enhance performance and security. The upgraded infrastructure will support the client's growing business needs, providing a robust foundation for future growth. Comprehensive security measures will be put in place to protect against cyber threats and ensure data integrity. Training sessions will be conducted to familiarize the client's IT team with the new systems and tools. Ongoing support and maintenance services will be provided to ensure the sustained performance and reliability of the upgraded infrastructure, enabling the client to focus on their core business objectives with confidence."
Garrison and Sons,Technology,Digital Transformation,$179 million,Pamela Cox,Data Warehouse Development,In Progress,"The project entails the deployment of a comprehensive cybersecurity framework to protect the client's financial data and systems from potential threats and vulnerabilities. This involves a detailed risk assessment, followed by the implementation of advanced security measures such as encryption, multi-factor authentication, and intrusion detection systems. The project also includes the development of incident response plans and regular security audits to ensure compliance with industry standards. Training programs will be conducted to raise awareness among the client's staff about best practices in cybersecurity. Continuous monitoring and support will be provided to detect and respond to any security incidents promptly. By enhancing the client's cybersecurity posture, the project aims to safeguard their financial assets and build trust with their customers."
"Craig, Ellis and Taylor",Technology,Data Analytics,$416 million,Robert Jones,Data Warehouse Development,Completed,"This custom software development project is aimed at creating a unique application that addresses the client's operational challenges, enhancing their overall productivity and efficiency. The project begins with a comprehensive requirements analysis to understand the client's needs and objectives. Based on this analysis, our team will design and develop a tailor-made software solution that integrates seamlessly with the client's existing systems. The application will incorporate advanced features such as real-time data analytics, automated workflows, and user-friendly interfaces. Rigorous testing will be conducted to ensure the software's reliability and performance. Training programs will be provided to ensure that the client's staff can effectively use the new application. Ongoing support and maintenance services will be offered to address any issues and implement updates, ensuring that the software continues to meet the client's evolving needs and contributes to their business success."
